DATE_CREATED,MEMBER_ID,SURVEY_ID,IP_ADDRESS,REC_ID,SL1,SL2,net_promoter_score_listen_for_good,l4g_meet_needs,l4g_respect,l4g_easy_get_services,l4g_connected,l4g_good_at,l4g_do_better,l4g_age,l4g_gender,l4g_race
2020-07-02T07:00:31+00:00,531051,274923972,68.98.88.244,11752921561,Human services,Targeted population support,10,Extremely well,Always,,,Ayudar a la comunidad de padres con niños de necesidades especiales con talleres que son fundamental en la educación IEP vida de custodia legal 18 años y más temas que nos Empodera a defender a nuestros hijos,Siguiendo haciendo en vivos en zoom Ring virtual y que se escuchen en todo Arizona.,,Male,Hispanic or Latino
2020-07-02T18:01:36+00:00,531051,274923972,72.208.118.127,11754720080,Human services,Targeted population support,10,Very well,Always,,,Knowledge and compassion,Nothing I am aware of at the moment,,Male,White
2020-07-07T03:01:29+00:00,531051,274923972,98.167.179.240,11764272105,Human services,Targeted population support,10,Extremely well,Always,,,Helping me emotionally adjust to a situation because the parent aid has been though the same thing. Giving me resources to help my child.,nothing I can think of at this time,,Female,White
2020-07-08T16:55:31+00:00,531051,274923972,152.132.9.197,11771835040,Human services,Targeted population support,9,Very well,Always,,,she was very clearly able to identify with my situation with a special needs child that the school will not recognize the dx for ASD.  She gave support and information to me,I am not sure of anything at this point as I am just starting this process,,Female,White
2020-07-08T19:12:09+00:00,531051,274923972,68.225.151.131,11772347856,Human services,Targeted population support,9,Fairly well,Mostly,,,connecting to resources,follow up,,Female,
2020-07-08T20:48:50+00:00,531051,274923972,174.238.129.172,11772730585,Human services,Targeted population support,10,Extremely well,Always,,,Understanding compassionate very informative and helpful!,Honestly nothing I was so impressed!,,Female,White
2020-07-08T20:49:14+00:00,531051,274923972,184.103.205.86,11772731474,Human services,Targeted population support,,Extremely well,Always,,,Nannette has been an amazing resource!!!  She has been kind helpful supportive and knowledgeable.,I'm not sure...I've had an amazing experience.,,Female,Hispanic or Latino
2020-07-09T04:25:01+00:00,531051,274923972,24.251.80.135,11773850395,Human services,Targeted population support,10,Extremely well,Always,,,Support,,,,
2020-07-10T17:52:06+00:00,531051,274923972,172.58.23.229,11779498355,Human services,Targeted population support,,Extremely well,Always,,,Contestar todas nuestras preguntas y muy amables gracias,Todo esta muy bien asi,,Female,Hispanic or Latino
2020-07-10T19:33:35+00:00,531051,274923972,174.238.141.22,11779809296,Human services,Targeted population support,10,Extremely well,Always,,,Finding resources and advocating on behalf of special needs family,Nothing! They were great,,Female,White
2020-07-13T07:14:42+00:00,531051,274923972,24.251.144.30,11785426703,Human services,Targeted population support,10,Extremely well,Always,,,1) raising awareness2) getting back to you 3) answering your questions,,,Female,Asian
2020-07-13T14:47:48+00:00,531051,274923972,68.226.115.126,11786566882,Human services,Targeted population support,9,Very well,Always,,,Connecting parents with resources,Having more connections for the younger kids not just the parents.,,Female,White
2020-07-13T15:23:32+00:00,531051,274923972,98.171.53.37,11786694206,Human services,Targeted population support,9,Fairly well,Mostly,,,Communication and information,NA,,Female,Hispanic or Latino
2020-07-13T21:12:53+00:00,531051,274923972,68.2.153.49,11787819921,Human services,Targeted population support,10,Very well,Always,,,Providing numerous resources from help with knowing everything about the guardianship process to when we have had major issues with abuse and neglect at the group home.,I think y'all are great,,Female,White
2020-07-14T01:13:18+00:00,531051,274923972,68.228.230.25,11788433002,Human services,Targeted population support,10,Extremely well,Always,,,Trato a personas,Todo perfecto,,Female,Hispanic or Latino
2020-07-15T15:53:27+00:00,531051,274923972,174.18.52.135,11794349143,Human services,Targeted population support,10,Very well,Always,,,explaining the options available and referrals,I actually really like the video conferencing. I think keeping that around after this pandemic finally ends would be helpful for many of us.,,Female,White
2020-07-15T21:06:36+00:00,531051,274923972,68.104.158.105,11795467978,Human services,Targeted population support,7,A little bit,Always,,,I need help with guardianship for my son. But I got this email before  email with all the info you have to offer. So still need that please,I'll let you know,,Female,White
2020-07-15T22:51:27+00:00,531051,274923972,174.237.128.127,11795785714,Human services,Targeted population support,10,Extremely well,Always,,,Ayudar y asesorar a los padres con niños especiales,A mi parecer no hay nada que mejorar por que me ayudaron y aconsejaron con todo lo que nesesitaba,,Female,Hispanic or Latino
2020-07-16T14:25:20+00:00,531051,274923972,71.209.154.190,11798032168,Human services,Targeted population support,10,Extremely well,Always,,,Listening and giving great resources and help to those who dont know.,Nothing. You're already doing wonderful,,Female,White
2020-07-17T10:56:32+00:00,531051,274923972,174.26.226.102,11801386925,Human services,Targeted population support,10,Extremely well,Always,,,Supporting all parents!,Nothing!,,Female,White
2020-07-17T14:43:25+00:00,531051,274923972,174.26.102.184,11802093969,Human services,Targeted population support,0,Not well at all,Never,,,Getting an attitude,If I don't answer my phone at work that means I'm at work,,Female,Black or African American
2020-07-18T02:06:11+00:00,531051,274923972,174.238.142.225,11803911715,Human services,Targeted population support,10,Extremely well,Always,,,Nos ayudan con informacion que necesitamos para nuestros niños y nos preparan a los padres para conocer nuestros derechos.,En mi opinión todo esta bien.,,Male,Hispanic or Latino
2020-07-20T07:41:38+00:00,531051,274923972,174.74.203.88,11808498313,Human services,Targeted population support,10,Extremely well,,,,Helping me understand what kind of help I can get for my two children.,I'm happy with all the help they have given me.,,Female,White
2020-07-21T15:09:29+00:00,531051,274923972,72.200.101.46,11813607862,Human services,Targeted population support,10,Extremely well,Always,,,Todo,Nada,,Female,Hispanic or Latino
2020-07-21T16:40:22+00:00,531051,274923972,65.115.120.154,11813953915,Human services,Targeted population support,10,Very well,Mostly,,,El apoyo sobre los pasos que hay que tomar de acuerdo a las necesidades de nuestros hijos.,Hacer mas sesiones informativas para ninos pequenos.,,Female,Hispanic or Latino
2020-07-21T22:23:28+00:00,531051,274923972,68.2.155.32,11815083566,Human services,Targeted population support,10,Extremely well,Always,,,En que encontré las preguntas k tenía sobre mi hija. Y sus respuestas nos ayudaron mucho.,Pues en mi opinión en nada todo está muy bien muy amables.,,Female,Hispanic or Latino
2020-07-21T23:41:22+00:00,531051,274923972,68.230.70.47,11815351668,Human services,Targeted population support,,Very well,Always,,,lo que hacen bien es que ofresen mucha ayuda para los ninos a mi me gusto su atencion y el tiempo que le dedican a uno para escuchar todas mis preguntas y dudas y muchos y ofresen muchos servicios que uno nosaven...orientan auno en muchas cosas que quisad uno no sabe ...aun que apenas boy a empezar con ustedes yo les agradesco mucho su ayuda..grasias nuevamente...,yo boy a empezar con  la ayuda para mi hijo  y todo me parecio muy bien.,,Female,Hispanic or Latino
2020-07-22T12:17:37+00:00,531051,274923972,174.26.233.231,11816991726,Human services,Targeted population support,10,Very well,Always,,,La información que nos dan qué es tan importante. Y nos sacan de muchas dudas.,Para mi con la información y trato que me an dado esta muy bien todo.,,Male,Hispanic or Latino
2020-07-24T14:27:42+00:00,531051,274923972,65.144.207.14,11825822457,Human services,Targeted population support,,Very well,Always,,,Having first hand experience.,Have resources to assist with applying for services and resources (completing forms advocating  etc.) when guardians are overwhelmed with daily life.,,,
2020-07-27T18:06:50+00:00,531051,274923972,70.176.200.254,11834736686,Human services,Targeted population support,10,Very well,Always,,,Listening and providing actionable advice and direction,,,Female,White
2020-07-30T17:55:52+00:00,531051,274923972,72.201.17.30,11848117191,Human services,Targeted population support,10,Extremely well,Always,,,Communcating with parents providing us with valuable and reliable information.,,,Female,Hispanic or Latino
2020-07-31T17:34:55+00:00,531051,274923972,107.77.245.44,11851988735,Human services,Targeted population support,10,Extremely well,Always,,,They helped me get the right information I’ve been looking for.,,,Female,Hispanic or Latino
2020-07-31T18:11:53+00:00,531051,274923972,68.2.205.111,11852108845,Human services,Targeted population support,10,Very well,Always,,,Knowledge and caring.,Don’t know.,,Female,White
2020-08-01T22:04:18+00:00,531051,274923972,184.103.61.47,11855798453,Human services,Targeted population support,10,Very well,Always,,,Communication and support,Nothing I can think of,,Female,White
2020-08-04T13:47:51+00:00,531051,274923972,98.167.182.180,11866926700,Human services,Targeted population support,10,Extremely well,Always,,,Explaining in detail things about iep and really listening to my particular situation,Nothing,,Female,Hispanic or Latino
2020-08-05T11:29:37+00:00,531051,274923972,98.167.247.195,11870928705,Human services,Targeted population support,10,Extremely well,Always,,,For me it was a great resource,?,,Female,White
2020-08-05T13:41:27+00:00,531051,274923972,72.201.40.142,11871397677,Human services,Targeted population support,10,Extremely well,Always,,,Families speaking to families. The specialists know what we’re going through.,Quicker response time.,,Female,White
2020-08-05T16:37:09+00:00,531051,274923972,174.238.19.62,11872098867,Human services,Targeted population support,10,Extremely well,Always,,,Resources taking through stuff & more,covid help for iep?Otherwise they are amazing,,Female,White
2020-08-06T16:31:30+00:00,531051,274923972,68.98.121.153,11876940012,Human services,Targeted population support,10,Extremely well,Always,,,Connecting you to more resources and providing support,Nothing,,Female,White
2020-08-06T19:11:31+00:00,531051,274923972,172.58.17.221,11877582194,Human services,Targeted population support,10,Very well,Always,,,Me regresaron pronto la llamada y me dieron la información necesaria.,Pues hasta ahora me parece todo bien.,,Female,Hispanic or Latino
2020-08-07T19:16:08+00:00,531051,274923972,172.58.23.133,11882001649,Human services,Targeted population support,10,Very well,Always,,,Guiar y proveer información  sobre recursos,,,Female,Hispanic or Latino
2020-08-08T14:57:53+00:00,531051,274923972,68.231.59.150,11884439389,Human services,Targeted population support,10,Extremely well,Always,,,Listening to a parents needs and concerns of their child. Immediately responds,Honestly I have no comment. Was super happy and feel comfortable calling if I need any help.,,Female,Hispanic or Latino
2020-08-09T01:01:51+00:00,531051,274923972,70.176.7.162,11885559403,Human services,Targeted population support,10,Extremely well,Always,,,Informationresources support,Advertising their existence and services,,Female,White
2020-08-10T16:18:52+00:00,531051,274923972,98.167.189.200,11889866151,Human services,Targeted population support,7,Very well,Always,,,I only talked on phone Person was very nice,Not sure I am only grandma  Gave info to daughter,,,
2020-08-11T19:52:55+00:00,531051,274923972,174.18.57.92,11893900914,Human services,Targeted population support,10,Extremely well,Always,,,Lorri made me feel like I was the only important person on her schedule that day. She wasn't in a rush and was so informative.,Make more people aware of what they can help with!,,Female,White
2020-08-12T01:51:22+00:00,531051,274923972,68.110.123.207,11894792380,Human services,Targeted population support,10,Extremely well,,,,Helping parents/families through the maze of raising a special kid.  Understanding from a true parent perspective.,I don't know except have a person in every school district. Haha.  It would be great though.,,Female,White
2020-08-12T12:32:16+00:00,531051,274923972,98.161.196.117,11895806895,Human services,Targeted population support,10,Very well,Always,,,Offering assistance and support with your child.,Not sure.I have not been involved with them long enough to find any areas of improvement.,,Female,White
2020-08-12T12:54:06+00:00,531051,274923972,184.98.76.251,11895857132,Human services,Targeted population support,10,Extremely well,Always,,,Everything,Nothing,,Female,White
2020-08-12T14:15:00+00:00,531051,274923972,172.58.21.169,11896112290,Human services,Targeted population support,10,Extremely well,Always,,,Communication and sound information.,Keep same person contact during process.,,Female,Hispanic or Latino
2020-08-12T15:22:05+00:00,531051,274923972,107.77.231.171,11896321392,Human services,Targeted population support,2,Not well at all,Mostly,,,Intake. During the intake process I felt supported and hopeful someone would be able to assist me.,The issue I had dealt with conservatorship of a minor with special needs. The resource I was pointed towards was the Attorney General's office. How can RSK not have an attorney or paralegal who is able to answer broad legal questions about issues concerning disability and the law? So basically I was told that there are no resources for legal assistance for families of children with disabilities unless one hires a paid attorney. If this is actually the case RSK should work to find pro Bono assistance or perhaps a law student who can offer assistance.,,Male,White
2020-08-13T07:03:52+00:00,531051,274923972,70.180.31.66,11898625881,Human services,Targeted population support,10,Extremely well,Always,,,Everything extremely helpful,N.a,,Female,Hispanic or Latino
2020-08-13T15:02:46+00:00,531051,274923972,98.171.1.71,11899691879,Human services,Targeted population support,10,Very well,Always,,,Dar apoyo alas familias en temas relacionados con nuestros hijos en sus necesidades especiales,Yo creo que todo está bien,,Female,Hispanic or Latino
2020-08-13T17:51:58+00:00,531051,274923972,174.18.69.130,11900197528,Human services,Targeted population support,10,Extremely well,Always,,,Support/resources/educating parents and families and listening!!!,Can’t think of anything right now,,Female,White
2020-08-14T00:44:29+00:00,531051,274923972,159.118.180.203,11901210317,Human services,Targeted population support,10,Very well,Always,,,Answering questions and helping families with getting started for seeking help,Not sure,,Female,Hispanic or Latino
2020-08-14T13:45:52+00:00,531051,274923972,97.124.80.110,11902777311,Human services,Targeted population support,5,Not well at all,Never,,,I don’t even remember talking to them,Who knows,,Female,White
2020-08-14T15:47:45+00:00,531051,274923972,184.101.219.156,11903135668,Human services,Targeted population support,10,Very well,Always,,,Being very informative giving guidance and help.,Nothing,,Female,Native American or Alaska Native
2020-08-17T07:08:43+00:00,531051,274923972,67.234.245.40,11908117037,Human services,Targeted population support,10,Extremely well,Always,,,I have reached out for 1 subject for the moment which is for help with  IEP and got more help and for that I’m very grateful! So I can see they’re great for family support with the school system.,I have yet to see anything that needs to be improved,,Female,
2020-08-17T17:07:38+00:00,531051,274923972,68.3.151.160,11909522697,Human services,Targeted population support,8,Very well,Always,,,Providing requested information,Return phone calls in a timely manner/you say you are going to call on a day expect to get a call,,Prefer not to say,White
2020-08-17T19:53:28+00:00,531051,274923972,98.171.20.85,11910018505,Human services,Targeted population support,6,Very well,Mostly,,,Las respuestas que les hacen los padres,Nose,,Male,Hispanic or Latino
2020-08-17T23:09:48+00:00,531051,274923972,68.104.245.154,11910516809,Human services,Targeted population support,10,Extremely well,Always,,,Listening caring and helping!,Doing pretty good as it is,,Female,
2020-08-18T16:54:25+00:00,531051,274923972,70.190.176.112,11912833139,Human services,Targeted population support,9,Very well,Always,,,Helpfulness. Quick responses,I was happy with my service,,Female,Native American or Alaska Native
2020-08-19T16:17:40+00:00,531051,274923972,70.185.47.47,11916218737,Human services,Targeted population support,10,Extremely well,Always,,,Prompt response. So very helpful and understanding!,,,Female,White
2020-08-20T09:54:34+00:00,531051,274923972,71.223.39.250,11918415832,Human services,Targeted population support,10,Extremely well,Always,,,Providing information and more,Continue to do what they are doing,,Female,Hispanic or Latino
2020-08-20T15:23:31+00:00,531051,274923972,68.98.226.96,11919326745,Human services,Targeted population support,10,Very well,Always,,,I felt understood without having to explain,N/a,,Female,White
2020-08-20T20:27:53+00:00,531051,274923972,98.177.161.206,11920241734,Human services,Targeted population support,10,Extremely well,Always,,,Supporting other parents that are struggling with their special kids.,N/A,,Female,White
2020-08-21T14:21:47+00:00,531051,274923972,72.210.56.106,11922283328,Human services,Targeted population support,10,Very well,Always,,,Empowering parents and caregivers by providing  social and emotional support and tools and resources for a safe and fulfilled life.,,,Female,White
2020-08-21T14:59:29+00:00,531051,274923972,72.222.146.80,11922395713,Human services,Targeted population support,10,Extremely well,Always,,,Finding resources and very friendly.,Not sure you guys are great,,Female,Native Hawaiian or other Pacific Islander
2020-08-21T15:14:52+00:00,531051,274923972,207.108.136.50,11922445178,Human services,Targeted population support,10,Extremely well,Always,,,Family support and resources.,They are doing great continue to gather information.,,,
2020-08-22T23:30:58+00:00,531051,274923972,173.219.178.17,11925243858,Human services,Targeted population support,7,A little bit,Mostly,,,Support,More resources,,Female,Hispanic or Latino
2020-08-23T03:06:47+00:00,531051,274923972,199.66.171.154,11925423315,Human services,Targeted population support,10,Very well,Always,,,,,,Female,Hispanic or Latino
2020-08-24T20:57:34+00:00,531051,274923972,72.217.113.205,11929287600,Human services,Targeted population support,0,Not well at all,Mostly,,,Classes,Parent to parent quickness of responses,,Female,White
2020-08-25T19:33:32+00:00,531051,274923972,75.167.199.123,11932384842,Human services,Targeted population support,10,Extremely well,Always,,,Understanding what other parents with special needs are going through.,nothing they're great!!,,Female,White
2020-08-26T01:06:41+00:00,531051,274923972,68.98.86.3,11933212561,Human services,Targeted population support,10,Extremely well,Always,,,Darnos consejos y apoyarnos en los pasos que tenemos que seguir para buscar beneficios para nuestros niños,No tengo idea apenas los estoy conociendo,,Female,Hispanic or Latino
2020-08-28T07:32:06+00:00,531051,274923972,72.201.182.79,11940413184,Human services,Targeted population support,10,Extremely well,Always,,,Los consejos que dan,Que todos alli den la misma ayuda siempre,,Female,Hispanic or Latino
2020-08-28T15:11:05+00:00,531051,274923972,184.101.169.80,11941479729,Human services,Targeted population support,10,Very well,Always,,,providing information and speaking from experience,,,,
2020-08-28T20:03:31+00:00,531051,274923972,70.163.231.63,11942275858,Human services,Targeted population support,10,Extremely well,Always,,,directing parents how to go about getting services for their special needs kid,nothing-- I was pleased!,,Female,White
2020-08-29T01:38:05+00:00,531051,274923972,68.3.240.234,11942959637,Human services,Targeted population support,10,Extremely well,Always,,,Listening understanding and supporting. Additionally giving resources and information that is very helpful.,I couldn’t think of anything to me was an excellent experience and I’m full of gratitude!,,Female,Another race or ethnicity please describe below
2020-08-29T16:49:58+00:00,531051,274923972,174.17.207.79,11944091480,Human services,Targeted population support,9,,Always,,,,,,,
2020-08-31T03:29:52+00:00,531051,274923972,75.167.169.137,11946191658,Human services,Targeted population support,10,Fairly well,Always,,,La arencion q brindan,No lo se,,,
2020-09-01T05:48:33+00:00,531051,274923972,184.98.78.13,11949656381,Human services,Targeted population support,10,Extremely well,Always,,,They had so much information I didn’t know about. They also understood that I was overwhelmed and continued to help me,I believe they did the best they could. I know they can offer more after the pandemic,,Female,Native American or Alaska Native
2020-09-01T16:15:03+00:00,531051,274923972,24.248.36.27,11951150958,Human services,Targeted population support,10,Extremely well,Always,,,Finding sources and caring about your situation.,Honestly they have been amazing for me.,,Female,White
2020-09-03T14:13:44+00:00,531051,274923972,24.56.20.246,11957541079,Human services,Targeted population support,10,Extremely well,Always,,,Explaining how and where to apply for services needed for the child,Can’t think of anything,,Female,White
2020-09-03T17:01:03+00:00,531051,274923972,75.167.185.97,11958103104,Human services,Targeted population support,10,Extremely well,Mostly,,,,,,,
2020-09-03T20:57:53+00:00,531051,274923972,184.101.12.76,11958798984,Human services,Targeted population support,10,Extremely well,Always,,,Understanding the Special Needs community providing helpful information listening caring & follow-through.,?,,Female,White
2020-09-04T08:05:02+00:00,531051,274923972,98.177.156.105,11960015992,Human services,Targeted population support,8,Fairly well,Always,,,Que se comunican con nosotros para darle seguimiento a nuestras necesidades de nuestro hijo.,Darnos un poco de mayor atención y agilizando un poco más nuestro proceso para atender las necesidades a nuestros hijos ya que son nuestra mayor prioridad.,,Male,Hispanic or Latino
2020-09-04T15:02:16+00:00,531051,274923972,71.223.33.66,11960951273,Human services,Targeted population support,9,Very well,Always,,,Communicate right back and helping with loads of information which is required exact on time,I think you guys are awesome and really know your job very well  blessings for each and every one work there,,Female,Asian
2020-09-04T15:46:25+00:00,531051,274923972,72.201.113.125,11961082235,Human services,Targeted population support,10,Extremely well,Always,,,Just moved from out of state. The conversation was a lesson in acronyms and services available wrapped in a list of resources. Exactly what I needed.,It was all very helpful.,,Female,White
2020-09-04T15:46:09+00:00,531051,274923972,152.132.9.197,11961082700,Human services,Targeted population support,10,Fairly well,Always,,,first hand knowledge and experience.  Compassionate support,Make the school give my child the services he needs.  I know you can't do that but if you could!,,Female,White
2020-09-04T16:07:04+00:00,531051,274923972,70.176.16.209,11961141897,Human services,Targeted population support,10,Very well,Sometimes,,,Dar información,Esta b ien,,Female,Hispanic or Latino
2020-09-04T18:17:53+00:00,531051,274923972,174.238.138.250,11961478594,Human services,Targeted population support,10,Extremely well,Always,,,Communication and knowledge of laws,Have a rep in yuma,,Male,White
2020-09-05T01:38:30+00:00,531051,274923972,72.201.136.222,11962378605,Human services,Targeted population support,,Very well,Always,,,listening helping and referring,I am not sure at this time.,,Female,Black or African American
2020-09-07T07:34:24+00:00,531051,274923972,68.98.235.120,11965691322,Human services,Targeted population support,10,Extremely well,Always,,,Taking their time out to evaluate specifically everything about the child.,I don't find anything they can do better. Everything is accurately done.,,Female,Hispanic or Latino
2020-09-07T13:53:11+00:00,531051,274923972,72.217.14.15,11966396725,Human services,Targeted population support,10,Extremely well,Always,,,My advocate helped me so much with resources and just support,Nothing,,Female,White
2020-09-07T22:37:38+00:00,531051,274923972,68.230.42.197,11967298199,Human services,Targeted population support,10,Very well,Always,,,En lo k nesecitaba me ayudaton,,,,Hispanic or Latino
2020-09-08T04:20:45+00:00,531051,274923972,184.103.171.248,11967825222,Human services,Targeted population support,10,Extremely well,Always,,,The specialist is an extremely good listener and very knowledgable.  I felt quickly at ease and comfortable sharing challenges.,I would like to reconnect with her now that I've had a conversation with a peer mom who has been trained and has experienced similar things along her journey as a special needs mom.,,Female,White
2020-09-09T12:35:37+00:00,531051,274923972,184.98.64.137,11972209997,Human services,Targeted population support,10,Extremely well,Always,,,Answering questions and following up,nothing,,Female,White
2020-09-09T12:47:58+00:00,531051,274923972,98.179.83.36,11972255096,Human services,Targeted population support,10,Very well,Always,,,Providing comprehensive lists of resources in a compassionate way,Nothing that I’m aware off,,Female,White
