DATE_CREATED,MEMBER_ID,SURVEY_ID,IP_ADDRESS,REC_ID,SL1,SL2,net_promoter_score_listen_for_good,l4g_meet_needs,l4g_respect,l4g_easy_get_services,l4g_connected,l4g_good_at,l4g_do_better,l4g_age,l4g_gender,l4g_race
2020-12-07T21:30:37+00:00,531051,274923972,72.223.77.222,12235777771,Human services,Targeted population support,,Extremely well,Always,,,Siempre tienen la solución correcta cuando se necesita ayuda.,Hasta ahora e teñido buena ayuda gracias.,,Female,Hispanic or Latino
2020-12-07T22:08:25+00:00,531051,274923972,174.17.90.62,12235898769,Human services,Targeted population support,10,Extremely well,Always,,,Providing credible accurate information for families navigating special education in a friendly manner. Explaining options.,I spoke with Laurie. She was amazing. I don't have any feedback for improvement.,,Female,White
2020-12-07T22:59:09+00:00,531051,274923972,68.230.121.51,12236048941,Human services,Targeted population support,10,Extremely well,Always,,,Laura did a fantastic job of breaking down the process of applying for services. Made it easier to understand. Was great to speak to another “medical parent”.,Nothing!,,Female,Hispanic or Latino
2020-12-10T23:16:47+00:00,531051,274923972,172.58.17.47,12247286966,Human services,Targeted population support,10,Very well,Always,,,Todo! Personalmente me han ayudado mucho con información y apoyo emocional,No tengo esa respuesta pues no tengo ninguna queja,,Female,Hispanic or Latino
2020-12-11T08:01:01+00:00,531051,274923972,98.171.11.148,12248195148,Human services,Targeted population support,10,Extremely well,Always,,,Giving resources and assisting with advocating for our kids,I don't know,,Female,White
2020-12-13T19:54:05+00:00,531051,274923972,68.106.24.98,12253627024,Human services,Targeted population support,10,Not well at all,Never,,,Hola hace unas semanas de ustedes por medio de la terapista ocupacional de mi hijo juan que tiene autismo,Hacer mas promociones de todo lo que brindan para nuestros hijos,,Female,Hispanic or Latino
2020-12-14T16:00:59+00:00,531051,274923972,174.73.166.152,12255826261,Human services,Targeted population support,10,Extremely well,Always,,,Understanding parents concerns and explaining the process in AZ.,Can’t think of anything,,Female,White
2020-12-14T16:28:13+00:00,531051,274923972,68.231.71.82,12255930011,Human services,Targeted population support,10,Very well,Always,,,El apoyo la información que proveen a las familias es indispensable para saber como podemos conocer nuestros derechos y mil gracias,En realidad todo está bien,,Female,Hispanic or Latino
2020-12-16T01:47:19+00:00,531051,274923972,98.177.156.129,12261040419,Human services,Targeted population support,10,Extremely well,Always,,,Muy buena información que todos los papás con niños especiales necesitamos y no savemos,Pues creo que es muy bueno y las personas también ahorita no se si necesita mejorar en algo,,Female,Hispanic or Latino
2020-12-16T04:33:40+00:00,531051,274923972,70.176.239.187,12261297280,Human services,Targeted population support,10,Fairly well,Always,,,I dont know much sbout. The program only thepeople are very supportive and helpful and genuinely caring.,I dont know im jus learning about program.,,Female,Hispanic or Latino
2020-12-16T20:07:58+00:00,531051,274923972,172.56.40.166,12263605626,Human services,Targeted population support,10,Extremely well,Always,,,Understanding the family and their needs.,N/A,,Female,White
2020-12-16T20:20:20+00:00,531051,274923972,174.74.224.32,12263641033,Human services,Targeted population support,10,Very well,Always,,,Communicating about resources in the Valley,Making it more clear what  you do or don't do on the website,,Female,White
2020-12-19T16:35:07+00:00,531051,274923972,70.180.26.16,12271414240,Human services,Targeted population support,9,Extremely well,Always,,,Explaining how IEP work and our rights,Nothing so far. I am very happy with the call I received,,Female,White
2020-12-19T18:35:25+00:00,531051,274923972,184.103.120.66,12271548668,Human services,Targeted population support,10,Extremely well,Always,,,Helping individuals fully understand how to navigate an IEP meeting,N/A,,Female,Black or African American
2020-12-21T08:36:31+00:00,531051,274923972,75.167.186.172,12273812652,Human services,Targeted population support,10,Extremely well,Always,,,Helping families of children who have special needs access resources navigate the pitfalls of education and developmental needs connect others with families in the same boat as them and help to keep families connected to the community. They really helped me from feeling so isolated and judged. They’re an invaluable lifeline for parents.,I’m not entirely sure. So far they’ve been a godsend for me and my family.,,Prefer to self-describe,White
2020-12-23T15:17:46+00:00,531051,274923972,172.58.17.92,12279744741,Human services,Targeted population support,10,Extremely well,Always,,,Communication and feeling connected and understood.,Partnering with charter or private schools,,Female,Asian
2020-12-25T08:44:40+00:00,531051,274923972,70.162.176.94,12282270374,Human services,Targeted population support,10,Extremely well,Always,,,Have help me with my son,They are doing good job,,Female,Hispanic or Latino
2020-12-27T00:36:56+00:00,531051,274923972,172.58.16.96,12283867698,Human services,Targeted population support,0,Not well at all,Sometimes,,,Returning phone calls in a timely manner,Be more communicative and be more willing to explain things to families more. You guys might answer the same questions 10x a day but for the family it's most likely the first time they've been in this situation. These kids aren't born with handbooksor resources. The parents don't get training like you do when you start a job. More patience and understanding would be amazing and extremely appreciated,,Female,White
2020-12-28T03:13:51+00:00,531051,274923972,71.223.29.245,12285111048,Human services,Targeted population support,10,Very well,Always,,,Giving information kind and informative. Team player,Have more staff. :),,Female,White
2021-01-04T14:08:04+00:00,531051,274923972,24.56.23.194,12296562586,Human services,Targeted population support,10,Extremely well,Always,,,Providing resource info,Nothing,,Female,White
2021-01-04T15:30:46+00:00,531051,274923972,72.223.39.237,12296836783,Human services,Targeted population support,10,Extremely well,Always,,,,,,Male,Other | Mexican
2021-01-04T16:03:05+00:00,531051,274923972,70.172.98.20,12296847580,Human services,Targeted population support,10,Fairly well,Always,,,Explaining what resources they provide.,Help family members enroll in their availability online live presentations.,,Female,Black or African American
2021-01-05T14:44:35+00:00,531051,274923972,174.73.220.61,12299341007,Human services,Targeted population support,8,Very well,Always,,,Dar orientación a los padres para ser un mejor apoyo a nuestros hijos excepcionales,Mantener una comunicación más cercana con nosotros.,,Female,Hispanic or Latino
2021-01-05T21:33:22+00:00,531051,274923972,71.209.224.105,12300452792,Human services,Targeted population support,10,Extremely well,Always,,,Understanding parents needs with special kids,,,Female,
2021-01-06T17:56:25+00:00,531051,274923972,174.74.140.72,12302751443,Human services,Targeted population support,8,Very well,Always,,,They answered my questions,Don’t know,,Female,White
2021-01-11T07:04:18+00:00,531051,274923972,104.129.199.86,12313083018,Human services,Targeted population support,10,Very well,Always,,,Helping families with special kids know that they are not alone.,Nothing I can think of!,,Male,White
2021-01-11T20:46:00+00:00,531051,274923972,72.24.242.68,12315233429,Human services,Targeted population support,10,Extremely well,Always,,,Information,Timely response to inquiries,,Female,White
2021-01-13T19:09:48+00:00,531051,274923972,71.223.137.58,12321584548,Human services,Targeted population support,,Very well,Always,,,They are a wonderful support system with a lot of compassionate employees.,,,Female,White
2021-01-14T03:16:15+00:00,531051,274923972,67.49.90.176,12322710606,Human services,Targeted population support,10,Extremely well,Always,,,Follow through,Nothing,,Female,White
2021-01-14T13:45:24+00:00,531051,274923972,72.211.174.102,12323735926,Human services,Targeted population support,10,Very well,Always,,,Providing support navigating through the IEP process,Attend meetings,,Female,Hispanic or Latino
2021-01-15T00:13:31+00:00,531051,274923972,68.3.148.40,12325576262,Human services,Targeted population support,10,Extremely well,Always,,,Providing support and comfort from knowledgeable people.,I was very pleased with my experience.,,Female,Native American or Alaska Native
2021-01-15T15:33:33+00:00,531051,274923972,98.171.24.103,12327241488,Human services,Targeted population support,10,Extremely well,Always,,,Helping to word my requests for special education services at my child's school.,This is my only encounter with them so far. I will be glad to ask for help again if needed.,,Female,White
2021-01-15T20:09:26+00:00,531051,274923972,184.101.16.128,12328040687,Human services,Targeted population support,10,Very well,Always,,,,,,Female,White
2021-01-19T21:14:54+00:00,531051,274923972,97.124.213.121,12337191931,Human services,Targeted population support,10,Extremely well,Always,,,covering ALL conserns,I cant think of one thing,,Female,White
2021-01-20T00:26:28+00:00,531051,274923972,47.216.32.104,12337716810,Human services,Targeted population support,10,Extremely well,Always,,,Communication support efficiency.. Everything!,,,Female,Hispanic or Latino
2021-01-20T19:05:11+00:00,531051,274923972,107.77.245.52,12340157802,Human services,Targeted population support,10,Extremely well,Always,,,Giving more knowledge to a patent about thier child who has special needs,No problems they are excellent,,Female,Other | White and Hispanic
2021-01-22T04:32:51+00:00,531051,274923972,70.163.168.229,12344786450,Human services,Targeted population support,9,Fairly well,Always,,,Providing resources,Have more information regarding uncommon situations,,Female,Hispanic or Latino
2021-01-22T05:21:07+00:00,531051,274923972,172.58.16.100,12344844273,Human services,Targeted population support,10,,,,,Really good on guiding me on what to do as far my child and her education and really reliable and helpful,I can’t think of anything at this moment so far everyone been great,,Female,Hispanic or Latino
2021-01-22T10:06:54+00:00,531051,274923972,172.58.17.113,12345291421,Human services,Targeted population support,9,A little bit,Always,,,Una communication con UN padre  que tiene hijo un con diaabilidades y que comprende y esta indormado de Las situaciones que tenemos que pasar,Tomando iniciativa y llamando  a Los Padres del nino para dar seguimiento. A .veces Los Padres estan tan ocupados o tienen Pena molestar SI no estan referidos .,,Male,Hispanic or Latino
2021-01-22T22:59:18+00:00,531051,274923972,174.74.245.4,12347403248,Human services,Targeted population support,10,Extremely well,Always,,,RSK is great at getting information out to families in a timely manner and in a way that is understandable. They get back to you quickly as well.,As of right now I can't think of anything they can do better. We had a great experience.,,Female,White
2021-01-24T01:15:38+00:00,531051,274923972,172.58.19.215,12349379633,Human services,Targeted population support,10,Very well,Always,,,Providing all the information that special needs family need.,They are amazing! I have no suggestion for changes.,,Female,Hispanic or Latino
2021-01-25T17:35:21+00:00,531051,274923972,184.101.184.59,12352786193,Human services,Targeted population support,10,Extremely well,Always,,,Providing information resources and helping make connections with mentors.,I'm not sure. They are already very helpful,,Female,White
2021-01-26T13:46:50+00:00,531051,274923972,184.103.244.160,12355377630,Human services,Targeted population support,10,Very well,Always,,,Giving important information support and classes,So far I have no complaints,,Female,White
2021-01-27T08:10:05+00:00,531051,274923972,184.103.126.192,12358150317,Human services,Targeted population support,10,Extremely well,Sometimes,,,Give resources for special needs kids.,Nothing. They are wonderful,,Female,White
2021-01-28T01:45:21+00:00,531051,274923972,172.58.16.167,12361261998,Human services,Targeted population support,10,Extremely well,Always,,,Tienen mucha orientation para para nuestros hijos y padres.,Todo es perfecto. Gracias,,Male,Hispanic or Latino
2021-01-28T19:34:52+00:00,531051,274923972,65.122.11.2,12363777620,Human services,Targeted population support,10,Extremely well,Always,,,Supporting my family throughout the growth of my son that has special needs.,,,Female,Hispanic or Latino
2021-01-29T16:02:53+00:00,531051,274923972,184.103.110.68,12366463899,Human services,Targeted population support,10,Extremely well,Mostly,,,Ayudar con la respuesta precisa y responder a tiempo las llamadas,Manténganse siempre al día con todos los resources de información más actívales como siempre para las familias,,Female,Hispanic or Latino
2021-01-30T00:48:46+00:00,531051,274923972,98.161.171.147,12367781951,Human services,Targeted population support,10,Extremely well,Always,,,helping individuals like myself to navigate a very frustrating difficult system.,Hire more individuals to help the multitude of individuals that do not know what to do or even how to begin to understand their needs and what to do why the situations at hand that can be difficult to navigate through.,,Female,White
2021-01-30T08:14:20+00:00,531051,274923972,98.161.219.178,12368274107,Human services,Targeted population support,10,Extremely well,Always,,,Nannette walked me through the entire 504 process and she is the reason I was able to apply as quickly as I did.,,,Female,White
2021-02-01T13:44:35+00:00,531051,274923972,97.124.209.108,12372111159,Human services,Targeted population support,10,Very well,Always,,,Como explican,,,Female,Hispanic or Latino
2021-02-01T15:40:11+00:00,531051,274923972,68.231.39.24,12372482856,Human services,Targeted population support,9,Very well,Always,,,Answering questions,Send fewer donation request emails. I got a donation request well before I got my questions answered. Also switch to email or text if you play phone tag with a parent. Some of us can't easily find time to chat via phone and voicemail may not be the best way to reach us either.,,Female,White
2021-02-01T21:00:45+00:00,531051,274923972,172.58.21.183,12373467136,Human services,Targeted population support,0,Not well at all,Never,,,Nose,No me interesa,,Female,Hispanic or Latino
2021-02-04T02:20:20+00:00,531051,274923972,98.177.21.157,12381075446,Human services,Targeted population support,10,Extremely well,Always,,,Explaining where to start why and how to start the process. The council I received was as if it were from someone who knew and cared about my child.,I can't think of anything to do differently. I was treated like a human being in need of help. I was called back listened to and given answers to my issues.,,Female,White
2021-02-04T15:22:00+00:00,531051,274923972,63.234.59.10,12382572577,Human services,Targeted population support,10,Extremely well,Always,,,Courtesy providing information and follow up,NA,,Male,Hispanic or Latino
2021-02-04T16:40:58+00:00,531051,274923972,70.163.176.224,12382832933,Human services,Targeted population support,10,Extremely well,Always,,,Caring and gave information that I needed and answered all my questions without making me feel like I didn’t know anything,I can’t think of anything,,Female,Hispanic or Latino
2021-02-05T16:28:21+00:00,531051,274923972,98.168.5.96,12386139194,Human services,Targeted population support,10,Extremely well,Always,,,Providing support,N/A,,Female,White
2021-02-06T03:22:04+00:00,531051,274923972,68.2.254.65,12387521750,Human services,Targeted population support,10,Very well,Always,,,Que no tardaron para devolver la llamada cuando deje el mensaje  y que se nota la disponibilidad de ayudar,Sin comentario,,Female,Hispanic or Latino
2021-02-08T16:03:57+00:00,531051,274923972,207.108.136.51,12392014059,Human services,Targeted population support,,Very well,Always,,,Matching parents with families based on experiences with similar challenges guardianship and school questions resources of all kinds.,,,Female,White
2021-02-08T16:19:41+00:00,531051,274923972,98.167.157.86,12392064445,Human services,Targeted population support,10,Very well,Always,,,Son miy atentos y la persona que me atendio me explico todo muy bien,No se exactamente pero creo estan bien,,Female,Hispanic or Latino
2021-02-08T21:45:57+00:00,531051,274923972,172.58.16.57,12393033455,Human services,Targeted population support,10,Extremely well,Always,,,Information,,,Female,White
2021-02-09T12:52:07+00:00,531051,274923972,198.241.2.1,12394648841,Human services,Targeted population support,10,Extremely well,Always,,,,,,Male,Hispanic or Latino
2021-02-09T14:06:27+00:00,531051,274923972,47.216.242.80,12394879472,Human services,Targeted population support,10,Extremely well,Always,,,Listening affirming validating feelings advocating and supporting,Keep doing what you are doing!,,Female,White
2021-02-10T18:16:43+00:00,531051,274923972,68.225.146.142,12399165091,Human services,Targeted population support,10,Extremely well,Always,,,Knowledgeable on multiple topics and putting in contact with other agencies and getting back to you quickly,,,Female,White
2021-02-11T15:36:30+00:00,531051,274923972,184.176.99.120,12401868929,Human services,Targeted population support,10,Extremely well,Always,,,Pretty much everything with Children with Disabilities. All the rules regulations laws and offers available. I'm sure there's a lot more but that's what I was helped with.,I don't have really have a answer to this. Kathy was amazing knowledgeable and answered all my questions. Just keep doing what you're doing RSK! 😊,,Female,White
2021-02-11T15:48:17+00:00,531051,274923972,174.237.129.192,12401896580,Human services,Targeted population support,10,Extremely well,Always,,,Supportive and informative,Not sure,,Female,White
2021-02-11T17:37:49+00:00,531051,274923972,70.162.109.172,12402259150,Human services,Targeted population support,10,Extremely well,Always,,,They help to understand no only more about my child but about what to do and gave me so help with my son's school.,Nothing you are amazing now.,,Female,White
2021-02-11T22:42:57+00:00,531051,274923972,70.176.73.8,12403123652,Human services,Targeted population support,10,Extremely well,Always,,,Dar información que no sabe uno cuando tiene hijos con discapacidadades muy valiosa información,No sabría decirles primera ves que tomo sus servicios,,Female,Hispanic or Latino
2021-02-12T13:50:08+00:00,531051,274923972,72.208.183.96,12404602527,Human services,Targeted population support,10,Extremely well,Always,,,Giving resources,,,Female,
2021-02-12T18:47:57+00:00,531051,274923972,172.58.16.39,12405459606,Human services,Targeted population support,10,Extremely well,Always,,,Que  ustedes nos den el conocimiento de saber como ayudar a nuestros hijos .muchas gracias..,Todo esta perfecto.,,Female,Hispanic or Latino
2021-02-13T00:08:56+00:00,531051,274923972,172.58.17.54,12406130550,Human services,Targeted population support,10,,,,,,,,,
2021-02-13T17:54:15+00:00,531051,274923972,70.190.252.204,12407316798,Human services,Targeted population support,10,Very well,Always,,,Information and resources,N/a,,Female,White
2021-02-15T15:58:38+00:00,531051,274923972,174.17.32.104,12410584844,Human services,Targeted population support,10,Very well,Always,,,The specialists are very caring and knowledgeable.,I have not been disappointed.,,Female,White
2021-02-15T17:00:37+00:00,531051,274923972,71.223.134.51,12410748327,Human services,Targeted population support,,Extremely well,Always,,,Listening and providing input,Nothing,,Female,White
2021-02-15T18:21:38+00:00,531051,274923972,174.237.139.165,12410944049,Human services,Targeted population support,10,Very well,Always,,,Helping families that have a special kid  and don’t know how to get in touch with the right services or agencies that provide oriented information to the parents to help their kids,Understanding and supportive information and people one on one communication .,,Female,Hispanic or Latino
2021-02-15T20:12:31+00:00,531051,274923972,184.103.244.160,12411192627,Human services,Targeted population support,10,Extremely well,Always,,,Giving parents support and important guidance and information.,More specific information,,Female,White
2021-02-16T15:14:02+00:00,531051,274923972,174.73.192.76,12413231578,Human services,Targeted population support,10,Extremely well,Always,,,,,,Female,White
2021-02-18T02:06:19+00:00,531051,274923972,172.58.17.228,12418432786,Human services,Targeted population support,10,Very well,Always,,,Directing you on the right path,Help people that have special kids to fill out legal papers,,Female,White
2021-02-18T08:29:56+00:00,531051,274923972,76.171.171.174,12418975034,Human services,Targeted population support,10,Extremely well,Always,,,Communication friendly,Nothing,,Female,White
2021-02-18T12:53:44+00:00,531051,274923972,174.238.145.5,12419818079,Human services,Targeted population support,10,Very well,Always,,,Apoyar a las familias ante sus dudas dirigirme en mi caso,Hacer recordatorios de sus lives estuve navegando en su página y no encontré el tema.,,Female,Hispanic or Latino
2021-02-19T13:06:56+00:00,531051,274923972,70.162.250.201,12423802605,Human services,Targeted population support,10,Extremely well,Always,,,They  understanding  and knowledgeable about our special kids needs.,More autism specific classes.,,Female,Hispanic or Latino
2021-02-20T19:44:02+00:00,531051,274923972,70.175.102.67,12427659342,Human services,Targeted population support,10,Very well,Always,,,Responder nuestras preguntas,Pera mi opinión todo está bien,,Female,Hispanic or Latino
2021-02-21T15:00:14+00:00,531051,274923972,70.162.228.26,12428998109,Human services,Targeted population support,8,Fairly well,Always,,,Resources,Reach out more to families with concerns they have,,Female,Hispanic or Latino
2021-02-23T13:49:12+00:00,531051,274923972,68.2.229.54,12434926414,Human services,Targeted population support,10,Extremely well,Always,,,,,,Female,Hispanic or Latino
2021-02-23T14:38:27+00:00,531051,274923972,172.58.17.208,12435089297,Human services,Targeted population support,10,Extremely well,Always,,,La información que brinda realmente ayuda ha tener más claridad para el paso a paso que debemos tener los padres en este tipo de situaciones,Al contrario necesitan para publicidad para que llegue a más gente necesitada,,Male,Hispanic or Latino
2021-02-23T21:32:54+00:00,531051,274923972,172.58.19.0,12436475661,Human services,Targeted population support,8,Very well,Always,,,Explaining Resources available,,,Female,White
2021-02-24T14:40:40+00:00,531051,274923972,68.3.141.246,12438670302,Human services,Targeted population support,10,Extremely well,Always,,,,,,Female,White
2021-02-24T15:26:58+00:00,531051,274923972,172.58.21.21,12438844057,Human services,Targeted population support,6,Not well at all,Mostly,,,I'm not sure what you help with at this time.,More timely on responses and reaching someone.,,Female,White
2021-02-24T21:19:20+00:00,531051,274923972,174.74.134.95,12439975477,Human services,Targeted population support,7,Very well,Always,,,Helping in understanding how things work,Have more people support them,,,
2021-02-25T11:56:03+00:00,531051,274923972,98.168.27.43,12441659164,Human services,Targeted population support,10,Extremely well,Always,,,Understanding and given very knowledgeable information.,Honestly I couldn’t say because I couldn’t have asked for anything better.,,Female,Hispanic or Latino
2021-02-25T15:17:30+00:00,531051,274923972,72.195.209.245,12442242897,Human services,Targeted population support,10,Extremely well,Always,,,Todo,Son ecxelentes,,Female,Hispanic or Latino
2021-02-25T17:31:48+00:00,531051,274923972,68.106.231.231,12442691728,Human services,Targeted population support,10,Extremely well,Always,,,quick responsevery informedgood at listening and understanding questions/needs,,,Female,White
2021-03-01T15:00:29+00:00,531051,274923972,174.248.197.128,12451916465,Human services,Targeted population support,0,Not well at all,Never,,,They are good at being neutral in IEP meetings and not choosing one side or the other to advocate for,I would have appreciated someone that really listened to my frustrations instead of taking them personally.,,Female,White
2021-03-01T15:09:59+00:00,531051,274923972,174.248.197.128,12451946107,Human services,Targeted population support,0,Not well at all,Never,,,Joining an IEP meeting and being neutral to helping the school and the parents,actually advocate for my child in IEP meetings. Although I had showed up to a meeting late Vicky R asked me if I had a learning disability. That was completely out of line and disrespectful. I never want to work with raising special kids again and plan to tell my friends how I was treated.,,,
2021-03-01T22:21:31+00:00,531051,274923972,174.238.0.144,12453360149,Human services,Targeted population support,10,Very well,Always,,,Pointing parents in the right direction to advocate for their children.,Free attorneys,,Female,White
2021-03-02T18:35:02+00:00,531051,274923972,68.106.232.114,12456117138,Human services,Targeted population support,,Not well at all,Sometimes,,,My child was to young!,help small chidren to!,,Female,
2021-03-04T07:23:58+00:00,531051,274923972,70.190.128.45,12461433651,Human services,Targeted population support,,Extremely well,Always,,,Understanding issues sharing resources and providing recommendations,Dont think of anything. Thanks a lot for your help.,,Male,Asian
